,Artists,Title,Lyrics
23,shadowraze,showdown,"TranslationsRomanization​​showdown Lyrics

MUPP broken your heart
Бу, блять! Ха-ха
Просыпайтесь нахуй (Let's go!)

Головы сияют на моей едкой катане
Голоса этих ублюдков по пятам бегут за нами
Погружённый в Изанами, все колёса под глазами
Её взгляд убьёт любого, её взгляд убьёт цунами
Похоронный марш гулей, на часах последний тик
Моя тати — Бравл Шелли, я несу ей дробовик
Ваши головы — мишени, я снесу их в один миг
Никаких резких движений — ваш хилбар на один хит
(Ha-ha-ha-ha-ha-ha!)
Динамайк — трипл килл, ха, нервы на пределе
Voice в моих ушах, я позабыл все дни недели
Как на лезвии ножа и шквал патрон, летят шрапнели
Psychokilla — весь мой шарм, вся эта мапа поредели
Эй, погоди, мои парни на Стокгольме
Мой showdown 1x1, и мои демоны все в форме
Если я зайду к вам в лобби — оно станет вам могилой
Если ты зайдешь — мне похуй, я не стартану и выйду, а-ха

По приказу Генерала Гавса!
— Бро, тут вообще сложная ситуация, все границы позакрывали нахуй. Ваще пиздец полный. Ща просто едем ближе ко Львову, но во Львове тоже пиздец начался, поэтому хуй знает
— Бля, чуваки, шутки шутками, но не занимайтесь хуйнёй, я вас умоляю. А-а-а!

Эй, я как Вольт — называй «Неуловимый»
Я в showdown'е как Кольт — твои патроны летят мимо
Ты на этой мапе ноль, ты не скрывайся, тебя видно
Я как Рико дал обойму, мой лайфстайл — psychokilla
De-Dead inside mode, я бегу по головам
Оверсайз весь шмот, я на трапе тут и там
Весь твой скилл — шаблон, я по рофлу на битах
Зачем мне октагон? Могу выйти на финдах, ха

Головы сияют на моей едкой катане
Голоса этих ублюдков по пятам бегут за нами
Погружённый в Изанами, все колёса под глазами
Её взгляд убьёт любого, её взгляд убьёт цунами
Генерал Гавс, ха, вижу вас без гема
Я отдал приказ, и все умрут от реквиема
Дота-рэп — топ-чарт, ха, наебал систему
Mute all chat, я на лям скупил все гемы, ха-ха
You might also like
Ха-а, бля98Embed"
24,Glass Animals,Heat Waves,"TranslationsItalianoDeutschFrançaisHeat Waves Lyrics
(Last night, all I think about is you)
(Don't stop, baby, you can walk through)
(Don't want, baby, think about you)
(You know that I'm never gonna lose)
Road shimmer wigglin' the vision
Heat, heat waves, I'm swimmin' in a mirror
Road shimmer wigglin' the vision
Heat, heat waves, I'm swimmin' in a—

Sometimes, all I think about is you
Late nights in the middle of June
Heat waves been fakin' me out
Can't make you happier now
Sometimes, all I think about is you
Late nights in the middle of June
Heat waves been fakin' me out
Can't make you happier now
Usually, I put somethin' on TV
So we never think about you and me
But today, I see our reflections clearly
In Hollywood, layin' on the screen
You just need a better life than this
You need somethin' I can never give
Fake water all across the road
It's gone now, the night has come, but

Sometimes, all I think about is you
Late nights in the middle of June
Heat waves been fakin' me out
Can't make you happier now

You can't fight it, you can't breathe
You say somethin' so lovin', but
Now I gotta let you go
You'll be better off in someone new
I don't wanna be alone
You know it hurts me too
You look so broken when you cry
One more and then I say goodbye
You might also like
Sometimes, all I think about is you
Late nights in the middle of June
Heat waves been fakin' me out
Can't make you happier now
Sometimes, all I think about is you
Late nights in the middle of June
Heat waves been fakin' me out
Can't make you happier now

I just wonder what you're dreamin' of
When you sleep and smile so comfortable
I just wish that I could give you that
That look that's perfectly un-sad
Sometimes, all I think about is you
Late nights in the middle of June
Heat waves been fakin' me out
Heat waves been fakin' me out

Sometimes, all I think about is you
Late nights in the middle of June
Heat waves been fakin' me out
Can't make you happier now
Sometimes, all I think about is you
Late nights in the middle of June
Heat waves been fakin' me out
Can't make you happier now
Road shimmer wigglin' the vision
Heat, heat waves, I'm swimmin' in a mirror
Road shimmer wigglin' the vision
Heat, heat waves, I'm swimmin' in a mirror80Embed"
25,Mr.Kitty,After Dark,"TranslationsEspañolAfter Dark Lyrics
I see you, you see me
How pleasant, this feeling
The moment you hold me
I missed you, I'm sorry
I've given what I have
I showed you I'm growing
The ashes fall slowly
As your voice consoles me

As the hours pass
I will let you know
That I need to ask
Before I'm alone
How it feels to rest
On your patient lips
To eternal bliss
I'm so glad to know
As the hours pass
I will let you know
That I need to ask
Before I'm alone
How it feels to rest
On your patient lips
To eternal bliss
I'm so glad to know
We're swaying to drum beats
In motion, I'm feeling
My patience controlling
The question, I won't speak
We're telling the stories
Our laughter, he knows me
We're leaving, we're talking
You're closer, it's calming

As the hours pass
I will let you know
That I need to ask
Before I'm alone
How it feels to rest
On your patient lips
To eternal bliss
I'm so glad to know
As the hours pass
I will let you know
That I need to ask
Before I'm alone
How it feels to rest
On your patient lips
To eternal bliss
I'm so glad to know
You might also like
The night will hold us close and the stars will guide us home
I've been waiting for this moment, we're finally alone
I turn to ask the question, so anxious, my thoughts
Your lips were soft like winter, in your passion, I was lost

As the hours pass
I will let you know
That I need to ask
Before I'm alone
How it feels to rest
On your patient lips
To eternal bliss
I'm so glad to know
As the hours pass
I will let you know
That I need to ask
Before I'm alone
How it feels to rest
On your patient lips
To eternal bliss
I'm so glad to know
As the hours pass
I will let you know
That I need to ask
Before I'm alone
How it feels to rest
On your patient lips
To eternal bliss
I'm so glad to know
As the hours pass
I will let you know
That I need to ask
Before I'm alone
How it feels to rest
On your patient lips
To eternal bliss
I'm so glad to know67Embed"
26,Chris Brown,Under The Influence,"TranslationsPortuguêsUnder the Influence Lyrics
Kido, Kido
K-K-Kido on the beat, better run it back

Fuckin' Robitussin
I don't know why this shit got me lazy right now, yeah
Can't do Percocets or Molly (Molly)
I'm turnin' one, tryna live it up here right, right, right

Baby, you can
Ride it, ooh, yeah
Bring it over to my place
And you be like
""Baby, who cares?""
But I know you care
Bring it over to my place
You don't know what you did, did to me
Your body lightweight, speaks to me
I don't know what you did, did to me
Your body lightweight, speaks to me

('Cane on it)
Yeah
Yeah (Yeah)

I can make it hurricane on it ('Cane on it)
Hunnid bands, make it rain on it (Rain on it)
Tie it up, put a chain on it (Chain on it)
Make you tattoo my name on it (Name on it), oh
Make you cry like a baby, yeah
Let's GoPro and make a video, yeah (Yeah)
Make you cry like a baby, yeah
Let's GoPro and make a video (Video)
Oh, yeah-yeah-yeah-yeah

Baby, you can
Ride it, ooh, yeah
Bring it over to my place
And you be like
""Baby, who cares?""
But I know you care
Bring it over to my place
You don't know what you did, did to me
Your body lightweight, speaks to me
I don't know what you did, did to me
Your body lightweight, speaks to me

('Cane on it)
('Cane on it)
('Cane on it)

Baby, you can
Ride it, ooh, yeah
(Molly, Molly)
And you be like
""Baby, who cares?""
But I know you care
(Molly, Molly)You might also like13Embed"
27,Dxrk ダーク,RAVE,"RAVE Lyrics


I like Dxrk

Hah, hah-hah, hah-hah, hah-hah, hah-hah
Hah-hah, hah-hah, hah-hah, hah-hah
Hah-hah, hah-hah, hah-hah, hah-hah
Hah-hah, hah-hah, hah-hah, hah-hah
Hah-hah, hah-hah, hah-hah, hah-hah
Hah-hah, hah-hah, hah-hah, hah
Hah-hah, hah-hah, hah-hah, hah-hah
Hah-hah, hah-hah, hah-hah, hah


Dxrk

Hah, hah-hah, hah-hah, hah-hah, hah-hah
Hah-hah, hah-hah, hah-hah, hah-hah

Hah-hah, hah-hah, hah-hah, hah-hah
Hah-hah, hah-hah, hah-hah, hah-hah
Hah-hah, hah-hah, hah-hah, hah-hah
Hah-hah, hah-hah, hah-hah, hah
Hah-hah, hah-hah, hah-hah, hah-hah
Hah-hah, hah-hah, hah-hah, hahYou might also likeEmbed"
28,Duman,Жіберем қалай?,"Жіберем қалай? (How Can I Let Go?) Lyrics
Сезімімді біле тұра, сені сүйе тұра
Жіберем қалай? Жіберем қалай?
Сезімімді біле тұра, сені сүйе тұра
Жіберем қалай?

Түн Алматы
Келем саған хабарламам бармады
Қайта-қайта сеніп төзім қалмады
Естеліктер телефонда бар ма әлі? Үміт бар ма әлі?
Қалғаны (қалғаны)
Сезімде емес махаббатта қалмады (қалмады)
Кешіруге енді себеп болмады
Сені бақытты қылу емес олардың арманы
Сезімімді біле тұра, сені сүйе тұра
Жіберем қалай? Жіберем қалай?
Сезімімді біле тұра, сені сүйе тұра
Жіберем қалай? (Оу-оу)
Сезімімді біле тұра, сені сүйе тұра
Жіберем қалай? Жіберем қалай?
Сезімімді біле тұра, сені сүйе тұра
Жіберем қалай? Қала-ай?

Білесің бе?
Мен сені қалай іздеп сағындым
Білесің бе?
Күніге ойлай түсімнен табылдың

Сезімімді біле тұра, сені сүйе тұра
Жіберем қалай? Жіберем қалай?
Сезімімді біле тұра, сені сүйе тұра
Жіберем қалай? (Оу-оу)
Сезімімді біле тұра, сені сүйе тұра
Жіберем қалай? Жіберем қалай?
Сезімімді біле тұра, сені сүйе тұра
Жіберем қалай? Қала-а-ай?
You might also like
Қала-а-ай?
Қала-а-а-ай?Embed"
29,V $ X V PRiNCE,Дом 50,"Дом 50 (Home 50) Lyrics
А, е-е, е
Алмата, на хуй
Е

Заходите, здрасьте
Приходите в гости
Мясо доедаю, оставляю только кости
Серьёзная встреча, время забито на восемь
От тебя воняет мефом, блять, иди помойся
Игрушка не детская, нарезаю кольца
Машина немецкая, мотоцикл японцев
Отпечатки пальцев никуда не скроются
Барыга не палится, хочешь познакомиться?
Still Жетісу 3, дом 50
Дед с панорамы задымял косяк
Подруги танцуют сёдня как хотят
Много индики и пива, пацаны висят
Still Жетісу 3, дом 50
Мои братья все летают, нет гуся
С утра ожидают, чё по новостям
Мне Саня отправляет бабки по частям

Still дрынь-дрынь-дрынь-дрынь
Дрынь-дрынь-дрынь-дрынь
Дрынь-дрынь-дрынь
Дрынь-дрынь-дрынь-дрынь-дрынь
Дрынь-дрынь-дрынь-дрынь
Дрынь-дрынь-дрынь-дрынь
Дрынь-дрынь-дрынь
Дрынь-дрынь-дрынь (м-м)

Bonah на детоксе, но это так сказать
Слева-справа сука, я попал в тесак
Асха, Кислый, Бона, это dirty sound
Это жёсткая химия, this wassup
(Оу-уо)
I'ma on the beat, ты же Weezy
Пара новых кросс, bitch, для улыбки (е, е)
Есть право на всё, но это leasing
Думаешь, ты лев, но ты пингвин
А, сука
Не влетаю без резинки, чисто принцип, уоу
Скушал вкусный завтрак, созвонился с Принцем, уоу
Жалю как пчела на твоём ринге, уоу-уоу (у)
Эй, let's go, а
You might also like
Still Жетісу 3, дом 50
Дед с панорамы задымял косяк
Подруги танцуют сёдня как хотят
Много индики и пива, пацаны висят
Still Жетісу 3, дом 50
Мои братья все летают, нет гуся
С утра ожидают, чё по новостям
Мне Саня отправляет бабки по частям

Still дрынь-дрынь-дрынь-дрынь
Дрынь-дрынь-дрынь-дрынь
Дрынь-дрынь-дрынь
Дрынь-дрынь-дрынь-дрынь-дрынь
Дрынь-дрынь-дрынь-дрынь
Дрынь-дрынь-дрынь-дрынь
Дрынь-дрынь-дрынь
Дрынь-дрынь-дрынь (м-м)Embed"
30,MiyaGi & Endspiel,I Got Love,"TranslationsEnglishI Got Love Lyrics

I got love, I
I got love, I
И-и-и-и-и, ха

Окутала меня, окутала
Ты будто мой сорт — мариуанна
Небо в алмазах, лето летало
Ты моя бэйби — дочь карнавала
Двигайся, крошка, принцесса бала
Ночь перемен, мысли растамана
Пока не устал музыка играла
Кто-то курил, кого-то впирало
Эта дура Дуремара, нам она
Было думал улетала в тёплые края
Лето, море, песок, но мне тебя мало
Танцую в пол, руки в потолок зала
Оттуда, куда пал, больше не вернусь
Чудом умотал и забрал с ней грусть
Это наша жизнь и ей всегда мало
Танцую в пол, руки в потолок зала
Go everybody shake your ass, go
Move everybody — моё любимое шоу
Голова качала, бачата давала маннама
Облава болванов, налы наваров
Бутора валом подавай нам
Когда будет этот день ты пой про себя
Про меня, за любовь, за маму, за брата
А-то судьба загнёт ата-ата
А-та-ман, я типа а-та-ман
В жарком танго меломан, мною правит бадман
Танцуй! Так примитивно
Танцуй! Так импульсивно
Танцуй! Дочь карнавала
Тут на танцполе тебя было мало, мало
I got love, I feel, I got you on my mind
I got love, my skill, my la-la, la-la-life (Мой man)
I got love, I feel, I got you on my mind
I got love, my skill, my la-la, la-la-life

Jah, Jah, Jah Bless! Окна завесим
Буден опять принцесса и деспот
Лаврами не взять твой пыл, куролесим (Э-эй)
И на волю по годам сорвёмся вместе
У-у-у, а-а-а!
У-у-у, а-а-а!
У-у-у, а-а-а!
У-у-у, а-а-а!
За мгновение облететь планеты нипочём
То барабанит дождь — тоска да печаль
Но ты светом добра озарила свободу
В танце двигали бёдра? М-м
Ты — моя румба, ты — моя самба
Ты — моя сальса, ты — моё танго
Дыма навали, volume наболтай
В этих объятиях со мною летай
Со мною летай, со мною летай
Со мною летай, со мною летай
Дыма навали, volume наболтай
В этих объятиях со мною летай
Со мною летай, со мною летай
Со мною летай, со мною летай
Дыма навали, volume наболтай
В этих объятиях со мною летай (Да, да, да)
You might also like
I got love, I feel, I got you on my mind
I got love, my skill, my la-la, la-la-life
I got love, I feel, I got you on my mind
I got love, my skill, my la-la, la-la-life (Е)

Это всего лишь игра, может быть, наверное
Даже твоя нагота
Воу, детка, я не верю!
Падай в руки ко мне, моя красота
Мы с тобою без гида, так надо
Тронула душу твоя мне, мила, ламбада
Чтобы попой крутила, есть бит, не жаль саба
Я горю с тобою, как шмаль в пабах, дай жара!
Готовый я оформить всем вам лойс
Кто умеет делать шума — make some noise
Жара до утра, в угаре толпа
Но я смотрю, вишь, на тебя лишь, веришь, ма? (Ма?)
И когда станет клуб утром клевать носом
Я украду тебя, будто Азор розу
Улыбнусь в тишине и скажу просто:
«Иди ко мне, солнце, расплетай косы»

У-у-у, а-а-а!
Расплетай косы
У-у-у, а-а-а!
Расплетай косы
У-у-у, а-а-а!
Иди ко мне, солнце, расплетай косы
У-у-у, а-а-а!
Расплетай косы
I got love, I feel, I got you on my mind
I got love, my skill, my la-la, la-la-life
I got love, I feel, I got you on my mind
I got love, my skill, my la-la, la-la-life
I got love, I feel, I got you on my mind
I got love, my skill, my la-la, la-la-life
I got love, I feel, I got you on my mind
I got love, my skill, my la-la, la-la-life

I got love, I feel
I got love, I feel16Embed"
31,Eminem,Mockingbird,"TranslationsTürkçePortuguêsItalianoDeutschFrançaisالعربيةMockingbird Lyrics
Yeah
I know sometimes
Things may not always make sense to you right now
But hey
What Daddy always tell you?
Straighten up, little soldier
Stiffen up that upper lip
What you cryin' about?
You got me
Hailie, I know you miss your Mom, and I know you miss your Dad
When I'm gone, but I'm tryin' to give you the life that I never had
I can see you're sad, even when you smile, even when you laugh
I can see it in your eyes, deep inside you wanna cry
'Cause you're scared, I ain't there, Daddy's wit' you in your prayers
No more cryin', wipe them tears, Daddy's here, no more nightmares
We gon' pull together through it, we gon' do it
Lainie, Uncle's crazy, ain't he? Yeah, but he loves you, girl, and you better know it
We're all we got in this world when it spins, when it swirls
When it whirls, when it twirls, two little beautiful girls
Lookin' puzzled, in a daze, I know it's confusin' you
Daddy's always on the move, Mama's always on the news
I try to keep you sheltered from it, but somehow it seems
The harder that I try to do that, the more it backfires on me
All the things growin' up as Daddy that he had to see
Daddy don't want you to see, but you see just as much as he did
We did not plan it to be this way, your mother and me
But things have got so bad between us, I don't see us ever bein'
Together ever again, like we used to be when we was teenagers
But then, of course, everything always happens for a reason
I guess it was never meant to be
But it's just somethin' we have no control over, and that's what destiny is
But no more worries, rest your head and go to sleep
Maybe one day we'll wake up and this'll all just be a dream
You might also like
Now hush, little baby, don't you cry
Everything's gonna be alright
Stiffen that upper lip up, little lady, I told ya
Daddy's here to hold ya through the night
I know Mommy's not here right now and we don't know why
We feel how we feel inside
It may seem a little crazy, pretty baby
But I promise Mama's gon' be alright

Heh, it's funny
I remember back one year when Daddy had no money
Mommy wrapped the Christmas presents up and stuck 'em under the tree
And said some of 'em were from me 'cause Daddy couldn't buy 'em
I'll never forget that Christmas, I sat up the whole night crying
'Cause Daddy felt like a bum—see, Daddy had a job
But his job was to keep the food on the table for you and Mom
And at the time, every house that we lived in
Either kept gettin' broken into and robbed or shot up on the block
And your Mom was savin' money for you in a jar
Tryin' to start a piggy bank for you so you could go to college
Almost had a thousand dollars, 'til someone broke in and stole it
And I know it hurt so bad it broke your Mama's heart
And it seemed like everything was just startin' to fall apart
Mom and Dad was arguin' a lot
So Mama moved back on to Chalmers in the flat, one-bedroom apartment
And Dad moved back to the other side of 8 Mile on Novara
And that's when Daddy went to California with his CD
And met Dr. Dre, and flew you and Mama out to see me
But Daddy had to work, you and Mama had to leave me
Then you started seein' Daddy on the TV
And Mama didn't like it
And you and Lainie were too young to understand it
Papa was a rolling stone, Mama developed a habit
And it all happened too fast for either one of us to grab it
I'm just sorry you were there and had to witness it firsthand
'Cause all I ever wanted to do was just make you proud
Now I'm sittin' in this empty house just reminiscin'
Lookin' at your baby pictures, it just trips me out
To see how much you both have grown, it's almost like you're sisters now
Wow, guess you pretty much are, and Daddy's still here
Lainie, I'm talkin' to you too, Daddy's still here
I like the sound of that, yeah, it's got a ring to it, don't it?
Shh! Mama's only gone for the moment
Now hush, little baby, don't you cry
Everything's gonna be alright
Stiffen that upper lip up, little lady, I told ya
Daddy's here to hold ya through the night
I know Mommy's not here right now and we don't know why
We feel how we feel inside
It may seem a little crazy, pretty baby
But I promise Mama's gon' be alright

And if you ask me to, Daddy's gonna buy you a mockingbird
I'ma give you the world
I'ma buy a diamond ring for you, I'ma sing for you
I'll do anything for you to see you smile
And if that mockingbird don't sing and that ring don't shine
I'ma break that birdie's neck
I'll go back to the jeweler who sold it to ya
And make him eat every carat, don't fuck with Dad! (Haha)400Embed"
32,Ayau,sybyrlaiyn <3,"​sybyrlaiyn 3 Lyrics

Қолымнан ұста
Ұшайық бірге ғарышқа
Ай ға ма әлде
Марсқа?
Қолымнан ұста
Жібермей енді дұрыстап
Аттанайық бирге
Алыс сапарға
Жаным сенің
Құлағыңа сыбырлайын
Сөздеріммен сені баурап
Мен елжіретіп алайын
Жаным сенің
Құлағыңа сыбырлайын
Сөздерімді тусінетін
Тек сен әрдайым

Әр кез жанымда
Болшы мен
Қайда болсамда
Болайын менде
Әр кез жаныңда
Қолымнан ұста
Жібермей енді дұрыстап
Өтерміз біз бірге
Сынақтардан

Жаным сенің
Құлағыңа сыбырлайын
Сөздеріммен сені баурап
Мен елжіретіп алайын
Жаным сенің
Құлағыңа сыбырлайын
Сөздерімді тусінетін
Тек сен әрдайымYou might also likeEmbed"
