,Artists,Title,Lyrics
80,Doja Cat,Woman,"TranslationsTürkçeEspañolPortuguêsDeutschFrançaisবাংলাRomână日本語Woman Lyrics
Hey, woman
Hey, woman

Woman
Let me be your woman
Woman, woman, woman (Ayy)
I can be your woman
Woman, woman, woman (Ayy)
Let me be your woman
Woman, woman, woman (Ayy)
I can be your woman
Woman, woman, woman (Ayy)
What you need?
She give tenfold, come here, papa, plant your seed
She can grow right from her womb a family
Provide lovin' overlooked and unappreciated, you see (Yeah)
You can reciprocate
I got delicious taste, you need a woman's touch in your place
Just protect her and keep her safe
Baby, worship my hips and waist
So feminine with grace
I touch your soul when you hear me say, ""Boy""
Let me be your woman

Woman
Lеt me be your woman
Woman, woman, woman
I can be your woman
Woman, woman, woman
Lеt me be your woman
Woman, woman, woman (Ayy)
I can be your woman
Woman, woman, woman

I can be your lady, I'm a woman
I'm a motherfucker, but they got a problem
Put some babies in your life and take away the drama
Put the paper in a picture like a diorama
Gotta face a lot of people of the opposite
'Cause the world told me, ""We ain't got the common sense""
Gotta prove it to myself that I'm on top of shit
And you would never know a god without the goddesses
Honest as fuckin' honest get
And I could be on everything
I mean I could be the leader, head of all the states
I could smile and jiggle it 'til his pockets empty
I could be the CEO, just look at Robyn Fenty
And I'ma be there for you 'cause you on my team, girl
Don't ever think you ain't hella these niggas dream girl
They wanna pit us against each other
When we succeedin' for no reasons
They wanna see us end up like we Regina on Mean Girls
Princess or queen, tomboy or king (Yeah)
You've heard a lot, you've never seen (Nah)
Mother Earth, Mother Mary rise to the top
Divine feminine, I'm feminine (Why?)
You might also like
Woman (Daddy)
Let me be your woman (Let me be your—)
Woman, woman, woman (Let me be your—)
I can be your woman
Woman, woman, woman (Daddy)
Let me be your woman (I know)
Woman, woman, woman (Daddy)
I can be your woman (I know)
Woman, woman, woman

Eee, eee, eee (Hey, woman)
(Woman)
Eee, eee, eee (Hey, woman)
Hey (Hey woman)
Mm-hmm, mm-hmm (Woman)
(Hey, woman)
(Hey, woman)49Embed"
81,Skryptonite,Цепи,"Цепи (Chains) Lyrics

Я проснулся в девять, попросту оттого, что (Чего?)
Дело на другом конце, и оно неотложное (Е-е-е)
У нас там и тут кругом гонцы, нам много что видно (Правда-правда)
Девять-девять процентов братьев моих шабит
На всё успевает каждый раз, и движ просто рисует (В самых)
В самых полны пачками из всех возможных сует (Я в ней)
Я в ней на легке ловлю самый удачный случай (Я ей)
Я ей на легке вставлю дважды на всякий случай
На мне цепи-цепи-цепи на шее и поцелуи-луи-луи-луи
Папа подарит тебе весь Louis
Надень шторы, ведь мы сияем, а не наши кроссы
Zorski-Zorski-Zorski-Zorski, мы молодые, но боссы
На мне цепи-цепи-цепи на шее и поцелуи-луи-луи-луи
Папа подарит тебе весь Louis
Надень шторы, ведь мы сияем, а не наши кроссы
Zorski-Zorski-Zorski-Zorski, мы молодые, но боссы

Я выдвинул в девять в город абсолютно трезвым (Трезвым)
Правое всё делит корбит, девять шлюх, три лесбы (Обильно)
Обильно на теле долбит, отдельно умеет, может
Стабильно уверен, хобби из самых интересных (Самых-самых-самых)
Сердце не двери для сожалений и повторов (Повторов)
Звук всегда умерен, даже где нет разговоров (Порох)
Порох, трах и порох (Порох), прямо в коридоре
(Бодрит) Что с утра на шторах, (На мне) сука как Rita Ora

На мне цепи-цепи-цепи на шее и поцелуи-луи-луи-луи
Папа подарит тебе весь Louis
Надень шторы, ведь мы сияем, а не наши кроссы
Zorski-Zorski-Zorski-Zorski, мы молодые, но боссы
На мне цепи-цепи-цепи на шее и поцелуи-луи-луи-луи
Папа подарит тебе весь Louis
Надень шторы, ведь мы сияем, а не наши кроссы
Zorski-Zorski-Zorski-Zorski, мы молодые, но боссы
You might also like
Это сорок пять в тени, мне нужен здесь веер
В этом воздухе фирмач, распрысканный спреем
Чем ты можешь удивить? (Серьёзно) Мне нужен весь веер
От деньжат до деньжищ, на которых мы взрослеем
Да, иногда заносит, но я всегда в курсе, где я (Где я?)
Вопрос только — деньги, деньги есть, ведь есть идея
(Ты знаешь) Иногда твой носик — лажа, а твоя неделя
Как один мой день, но у нас нет даже похмелья
Если суета — вид спорта, то мы вышли на мир (Е)
Суети, как в ту субботу, продолжаю звонить (Е)
После суети и оптом и нихуя не пойми
Ведь не дрёт дрянь, монстр, сколько себя не корми
Да, мне стало скучно с теми, с теми и даже вон с теми
Не, мне так было всегда, ведь весь мой интерес на деле
Я смотрю на их движенья, ржу, как будто смотрю телек
Деньги-деньги, и огромный хуй из денег на их мненье

На мне цепи-цепи-цепи на шее и поцелуи-луи-луи-луи
Папа подарит тебе весь Louis
Надень шторы, ведь мы сияем, а не наши кроссы
Zorski-Zorski-Zorski-Zorski, мы молодые, но боссы
На мне цепи-цепи-цепи на шее и поцелуи-луи-луи-луи
Папа подарит тебе весь Louis
Надень шторы, ведь мы сияем, а не наши кроссы
Zorski-Zorski-Zorski-Zorski, мы молодые, но боссы38Embed"
82,Beach Weather,"Sex, Drugs, Etc.","Sex, Drugs, Etc. Lyrics
Late night telephone
Calling all the wallflowers I know
Out the dark and into the light
Half love, half regret
Dressing up for Polaroids and cigarettes
Socialize, romanticize the life

Floating on my low-key vibe
Floating on my low-key vibe, vibe, vibe
I don't need that late night high
I'm floating on my vibe
Vibe, vibe
Vibe
Vibe, vibe
Bulletproof passengers
On the road to sex, drugs, et cetera
Get out the dark and into the light
Everywhere I go I know that I don't wanna be
Part of something I won't ever need
Your socialized, romanticized life

Floating on my low-key vibe
Floating on my low-key vibe, vibe, vibe
I don't need that late night high
I'm floating on my vibe
Vibe, vibe
Vibe
Vibe, vibe

Out of touch in harmony
Designer drugs from dead end streets
Break the air to feel the fall
Or just feel anything at all

Floating on my low-key vibe
Floating on my low-key vibe, vibe, vibe
I don't need that late night high
I'm floating on my vibe
Vibe, vibe
Vibe
Vibe, vibe
You might also like
Floating on my low-key vibe
Floating on my low-key vibe, vibe, vibe
I don't need that late night high
I'm floating on my—12Embed"
83,xxxmanera,Never Broke Again,"Never Broke Again Lyrics

Люди всегда готовы дать свою любовь кому-нибудь, кто этого заслуживает
(I got my swag now)
Так случилось со мной, так случится и с тобой
(Yeah, I got my own-own swag now)
Будь терпимее к людям и знай: быть добрым — всегда самый беспроигрышный вариант
(Yeah, I got my own-own-own-own-own-own-own-own)

Grind it, chop it, mix it, flava-it
Bitch I get it on my mind
Smoke it, roll it, taste it, bang it
Bitch I can't get even high
You can't get way that I'm flexin'
Bitch I'm on my demon time
You know this my flow is extending
I grab the shit of my crime
Сломанный ублюдок — тот, кем мне никогда не стать
Карманы жрут купюры, стоило мне лишь начать
Словно Boeing, сука
Манера создан, чтоб летать
Мне не тянули руку
Я сам научился сиять

Grind it, chop it, mix it, flava-it
Bitch I get it on my mind
Smoke it, roll it, taste it, bang it
Bitch I can't get even high
You can't get way that I'm flexin'
Bitch I'm on my demon time
You know this my flow is extending
I'm grab the shit of my crime
Grind it, chop it, mix it, flava-it
Bitch I get it on my mind
Smoke it, roll it, taste it, bang it
Bitch I can't get even high
You can't get way that I'm flexin'
Bitch I'm on my demon time
You know this my flow is extеnding
I'm grab the shit of my crime
You might also like
Кто бы мог подумать, а
Lil shawty точно влюблена
Тупит, но вроде не дура, а
Запрыгнет со мной в бумер, а
Я видел это тыщу раз
Две тыщи слёз из тыщи глаз
Манера bless, топлю на газ
Ты знаешь, что скажу сейчас

Grind it, chop it, mix it, flava-it
Bitch I gеt it on my mind
Smoke it, roll it, taste it, bang it
Bitch I can't get even high
You can't get way that I'm flexin'
Bitch I'm on my demon time
You know this my flow is extending
I'm grab the shit of my crime9Embed"
84,Imagine Dragons,Bones,"TranslationsEspañolBones Lyrics
Gimme, gimme, gimme some time to think
I'm in the bathroom, looking at me
Face in the mirror is all I need (Ooh-ooh)
Wait until the reaper takes my life
Never gonna get me out alive
I will live a thousand million lives (Ooh-ooh)

My patience is waning, is this entertaining?
Our patience is waning, is this entertaining?
I-I-I got this feeling, yeah, you know
Where I'm losing all control
'Cause there's magic in my bones
I-I-I got this feeling in my soul
Go ahead and throw your stones
'Cause there's magic in my bones

Playin' with a stick of dynamitе
There was nevеr gray in black and white
There was never wrong 'til there was right (Ooh-ooh)
Feelin' like a boulder hurtlin'
Seein' all the vultures circlin'
Burnin' in the flames, I'm workin' in
Turnin' in a bed, that's darkenin'

My patience is waning, is this entertaining?
Our patience is waning, is this entertaining?

I-I-I got this feeling, yeah, you know
Where I'm losing all control
'Cause there's magic in my bones (In my bones)
I-I-I got this feeling in my soul
Go ahead and throw your stones
'Cause there's magic in my bones
You might also like
'Cause there's magic in my bones

Look in the mirror of my mind
Turnin' the pages of my life
Walkin' the path so many paced a million times
Drown out the voices in the air
Leavin' the ones that never cared
Pickin' the pieces up and buildin' to the sky

My patience is waning, is this entertaining?
My patience is waning, is this entertaining?

I-I-I got this feeling, yeah, you know
Where I'm losing all control
'Cause there's magic in my bones (Magic in my bones)
I-I-I got this feeling in my soul (Soul)
Go ahead and throw your stones
'Cause there's magic in my bones

There goes my mind, (I-I-I) don't mind
There goes my mind (There it goes, there it goes)
There goes my mind, (I-I-I) don't mind
There goes my mind (There it goes)
'Cause there's magic in my bones13Embed"
85,Kordhell,Live Another Day,"Live Another Day Lyrics
Here I go again, in the wind with my TEC-9
Cocked on my feet as I sneak closer to the crime
Here I go again
Here I go again
Cocked on my feet as I sneak closer to the crime
Here I go again, in the wind with my TEC-9
Cocked on my feet as I sneak closer to the crime
Here I go again
Here I go again
Cocked on my feet as I sneak closer to the crime
Here I go again, in the wind with my TEC-9
Cocked on my feet as I sneak closer to the crime
Here I go again
Here I go again
Cocked on my feet as I sneak closer to the crime
Here I go again, in the wind with my TEC-9
Cocked on my feet as I sneak closer to the crime
Here I go again
Here I go again
Cocked on my feet as I sneak closer to the crime

Sneak through the crowd, got real for me to get away
Needa get away, go- gotta drive a getaway
Now needa ne- got real for me to get away
Needa get away gotta wait 'till another day
Sneak through the crowd, got real for me to get away
Needa get away, go- gotta drive a getaway
Now needa ne- got real for me to get away
Needa get away gotta wait 'till another day

Here I go again, in the wind with my TEC-9
Cocked on my feet as I sneak closer to the crime
Here I go again
Here I go again
Cocked on my feet as I sneak closer to the crime
You might also likeHere I go again, in the wind with my TEC-9
Cocked on my feet as I sneak closer to the crime
Here I go again
Here I go again
Cocked on my feet as I sneak closer to the crime

Sneak through the crowd, got real for me to get away
Needa get away, go- gotta drive a getaway
Now needa ne- got real for me to get away
Needa get away gotta wait 'till another day
Sneak through the crowd, got real for me to get away
Needa get away, go- gotta drive a getaway
Now needa ne- got real for me to get away
Needa get away gotta wait 'till another day

Needa get away gotta wait 'till another day
Needa get away gotta wait 'till another day4Embed"
86,Miyagi & Andy Panda,Патрон,"Патрон (Patron) Lyrics

Тут патрон в патроннике, ежели что
Головы рубили, зарабатывал вес
Тут каждый, кто бил, добивая, нашёл
Личную выгоду и свой интерес
Накал пламенел, озарял города
Неминуемая яма лыбу давила ехидно
Тут человек пропадал навсегда
В самом себе себя же не было видно
В этом омуте карикатур слово, что вода
В голову залез топор, троглодиты, налетай
Сохрани ты, беспризорник, это пламя на века
Тут ракеты поджигали, ожидая благодать
Тесная лирика слов
Обнаружила меня ты снова без ответа
Ноты потеряли любовь
Ноги не вели туда, где была мечта заветная

Где была мечта заветная
Где бы—, где была мечта заветная
Где была мечта заветная
Где бы—, где была мечта заветная
Где была мечта заветная
Где бы—, где была мечта заветная
Где была мечта заветная (И, м)

Тут патрон в патроннике, ежели что
Головы рубили, зарабатывал вес
Тут каждый, кто бил, добивая, нашёл
Личную выгоду и свой интерес
Накал пламенел, озарял города
Неминуемая яма лыбу давила ехидно
Тут человек пропадал навсегда
В самом себе себя же не было видно
You might also like
Район испорченный, c'est la vie
Мы же измотаны, помоги
Боссы и коршуны без любви
Летают над городом фонари
Так угасала дикая страсть
Об этом не стоит просить и писать
Но я беру силы извне, черпаю, что есть
Большая история началась здесь
И сейчас руины полезут из недр
Тянутся выше до неба
Играет моя фонотека
Она сохранит человека
Верю в удачный исход поединка
Если не сейчас, знаю: впереди так
Голову забили злые языки
I need some sleep

Тут патрон в патроннике, ежели что
Головы рубили, зарабатывал вес
Тут каждый, кто бил, добивая, нашёл
Личную выгоду и свой интерес
Накал пламенел, озарял города
Неминуемая яма лыбу давила ехидно
Тут человек пропадал навсегда
В самом себе себя же не было видно
Тут патрон в патроннике, ежели что
Головы рубили, зарабатывал вес
Тут каждый, кто бил, добивая, нашёл
Личную выгоду и свой интерес
Накал пламенел, озарял города
Неминуемая яма лыбу давила ехидно
Тут человек пропадал навсегда
В самом себе себя же не было видно
Тут патрон в патроннике, ежели что, ежели что
Тут патрон в патроннике, ежели что
Тут патрон в патроннике, ежели что
Тут патрон в патроннике, ежели что25Embed"
87,akha,Insomnia,"Insomnia a.k.a godson LyricsAnd I truly believe insomnia starting to get the best of me
And I feel I need to relieve this weight off my chest to breathe
'cause I just can't sleep at night
Paranoid visions appear so clear in my hindsight
While I wait for this dope to crack back in my pipe
It gives me a chance to look back at my life
And it s no wonder why I had to be high 90 percent of the time
Now it seems to me they were just poor attempts to realign my mind
And escape this mundane life of mine
Well, welcome to the life and times of the D to the IR-T-Y
Lately its looking like I'll for surely die
By the age of 35
And it seems like yesterday I was serving mine
Two years at the mental-jail high
And I ain't did s--t but watch my life fly by in a blink of an eye and look at me now Im contemplating suicide
But that won't be my demise
Cause these hater's and ho's telling lies
They be the ones that I despise
Or could it just be the reflection of me
Relentlessly won't let me see
I'm blind behind the design of my disguise
Should I give up and become the host of all my f---ing lies
To weak to even read the empty space between each written line
Confined to the space between each gifted mind
Need i remind you keep hanging up with giving a f----
About who's getting what and why ain't i getting mine
Yeah, you keep slipping up wanting so bad to sip from the cup
Thats filled with the blood that dripped from God's given only son
And it still ait good enough?
Enough's enough
You did it once too much the want to touch the ones you loved once
But not your loved ones
And it rips you apart
You depart so far from whats left of your f---ing heart
And i truly believe insomnia is starting to get the best of me
And i feel i need to relieve this weight off my chest to f---ing breathe
'cause I just can't sleep...
I just can't f---ing sleep...
Now my days and nights consumed with watching the hands of time there is no doubt in my mind they want me dead
Alone and left to confide with the demons in my head
No rhyme or reason just constantly repeating
Are the words of what they said
Just do it and get it over with
But this ink on my back goes much deeper than the skin
Its the reason why I even f---ing exist
So ever since my life's consist of puffing this blissful mist
Slowly becoming this sinful kiss
And its as simple as this
All it takes is the twist of a blade across my f---ing wrist
And believe you me it could end like this
So what the f--- if i lost sight
Temporarily blinded by this guiding light
Only leading me to the end of a grimy pipe
An empty life
Oh how easy it would be just to get a grip
But instead I wish to slip into that eternal sleep
And the yearn is burning me internally
And this is why I believe its in my destiny to want to rest in peace
And this is why i believe
This is why I believe I need to be buried 6 feet deepYou might also like1Embed"
88,Miyagi & Andy Panda,Minor,"Minor Lyrics

(Угу-угу, е, е, е
Тупо доверять, е-е, е, е, е
На-на-на, м, е, е, е
Тупо доверять, доверять, доверять)
А, я, а

Я сам будто себя наказал этим непониманием, е, е, е
Перестал себе тупо доверять и без устали жаловался на людей
Караван гремел, и негодяй потешал себя баснями о воде
Но то были миражи, ты — покаяние моё, найди-ка меня скорей
Пустынями верными я кочевал, да песок глотал следы
И не надо быть тут пророком, чтобы понимать суету беды
Сам приволок эти пули, чё мыслями-выстрелами судьбы
Убивали во мне этого бога, чё по сути был поводырь
(М-м—) Моё тело — минор, боле не жалей ты тело, минор
Грязными пальцами боле не трожь мою душу недоношенную
Тело — минор
Здесь для тоски вереницами пульса
Недоброжелатели точили топор
Я скоротаю те дни, что велела судьба-негодяйка, сам, в одного

Настроение lo-fi, тело — минор, как и трек, зай
Понял, чувства эти подвели меня, я запомнил, 'till we die
Тело — минор, я не веселюсь, тело — минор
Ну-ка улыбнись, чтобы вспомнить жизнь, задышать полной грудью — и вон, ах
Знаю, что люди несут в своём body грустные судьбы, ах
Я тоже отчасти такой же — Ронин на перепутье, ах
Куда занесёт моё дело? И кто тот счастливчик, постойте, ах
В отражении радость, только не беспокойте

(М-м—) Моё тело — минор, боле не жалей ты тело, минор
Грязными пальцами боле не трожь мою душу недоношенную
Тело — минор
Здесь для тоски вереницами пульса
Недоброжелатели точили топор
Я скоротаю те дни, что велела судьба-негодяйка, сам, в одного
(М-м—) Моё тело — минор, боле не жалей ты тело, минор
Грязными пальцами боле не трожь мою душу недоношенную
Тело — минор
Здесь для тоски вереницами пульса
Недоброжелатели точили топор
Я скоротаю те дни, что велела судьба-негодяйка, сам, в одного
You might also like
(О) Моё тело — минор (Тело — минор)
(О) Моё тело — минор (Тело — минор)
(О) Моё тело — минор (Тело — минор)
(О) Моё тело — минор (Тело — минор, тело — минор)11Embed"
