,Unnamed: 0,Unnamed: 0.1,Unnamed: 0.1.1,Unnamed: 0.1.1.1,Unnamed: 0.1.1.1.1,Artist,Title,Lyrics,Translations,Languages,Processed translations
51,51,51,51,51,51,Semicenk,Al Sevgilim,"Al Sevgilim Lyrics[""Al Sevgilim"" için şarkı sözleri

Al sevgilim kır kalbimi
Yine paramparça kalsın
Yalnızlığım kader değil
Bunu ellerinle yazdın
Al sevgilim kır kalbimi
Yine paramparça kalsın
Yalnızlığım kader değil
Bunu ellerinle yazdın
Aklımı sorma, çoktandır kayıp
Sana takılı kalmış gönül de
Gözümde hülya dilimde dört satır
Seni anlatır
Geçtiğim sokaklar seni tanır
Artık yabancı değil yüzüm ona asık
Ve daim kırdığım kalpleri
Toplasan ceplerin boş kalır

Al sevgilim kır kalbimi
Yine paramparça kalsın
Yalnızlığım kader değil
Bunu ellerinle yazdın
Al sevgilim kır kalbimi
Yine paramparça kalsın
Yalnızlığım kader değil
Bunu ellerinle yazdın

Aklımı sorma, çoktandır kayıp
Sana takılı kalmış gönül de
Gözümde hülya dilimde dört satır
Seni anlatır
Geçtiğim sokaklar seni tanır
Artık yabancı değil yüzüm ona asık
Ve daim kırdığım kalpleri
Toplasan ceplerin boş kalır
You might also like
Al sevgilim kır kalbimi
Yine paramparça kalsın
Yalnızlığım kader değil
Bunu ellerinle yazdın
Al sevgilim kır kalbimi
Yine paramparça kalsın
Yalnızlığım kader değil
Bunu ellerinle yazdın
(Yazdın, of, of!)Embed","Take My Love Lyrics[Lyrics for ""Take My Love""

Take my darling, break my heart
be shattered again
My loneliness is not destiny
You wrote this with your hands
Take my darling, break my heart
be shattered again
My loneliness is not destiny
You wrote this with your hands
Don't ask my mind, long lost
The heart is attached to you
Dream in my eyes, four lines in my tongue
tells you
The streets I pass know you
I'm not a stranger anymore, my face is in love with him
And the hearts I always break
If you collect, your pockets will be empty.

Take my darling, break my heart
be shattered again
My loneliness is not destiny
You wrote this with your hands
Take my darling, break my heart
be shattered again
My loneliness is not destiny
You wrote this with your hands

Don't ask my mind, long lost
The heart is attached to you
Dream in my eyes, four lines in my tongue
tells you
The streets I pass know you
I'm not a stranger anymore, my face is in love with him
And the hearts I always break
If you collect, your pockets will be empty.
You might also like
Take my darling, break my heart
be shattered again
My loneliness is not destiny
You wrote this with your hands
Take my darling, break my heart
be shattered again
My loneliness is not destiny
You wrote this with your hands
(You wrote it, of, of!)Embed",tr,"{'hand', 'ask', 'empty', 'long', 'eye', 'attached', 'loneliness', 'darling', 'four', 'dream', 'lyricslyrics', 'stranger', 'tongue', 'street', 'shattered', 'love', 'face', 'pas', 'collect', 'pocket', 'lost', 'wrote', 'heart', 'mind', 'break', 'line', 'destiny'}"
52,52,52,52,52,52,Zeynep Bastık,Ara,"Ara Lyrics

Yavaş yavaş yakar
Bırakmıyo' ki aşk
Sensiz kendimden geçtim dalıp uzaklara
Aşk gidip dönmemek mi?
Böyle özlemek mi?
Yok mu mutlu bir son?
Vurulup ölmemek mi, ah
Var mı başka bir yol?
Dinmez ki şu hasretin sesi ""Sus!"" dedikçe
Uçurumdayım, gelip tut elimden
Ya da düş benimle, ah

Ara, ara, ara
Doldu kalbim yara
Başa sara sara
Ara, ara, ara
Sanki en dipteyim, çıkar boğulmadan
Ara, ara, ara
Doldu kalbim yara
Başa sara sara
Ara, ara, ara
Sanki en dipteyim, çıkar boğulmadan

Azalır mı acılar sarılıp anılara?
Yorar ayrılığın yükü geçip üzerimden
Başa sarıyor, niye?
Yetmiyor yine geceler
Sanki unutmuş doğmayı bize güneş
Anla şu çilemden, geçtim bu bedenden yine seni beklerken
Çekip gidemez kalp böyle tükenirken, kırılıp dökülürken
You might also like
Dinmez ki şu hasretin sesi ""Sus!"" dedikçe
Uçurumdayım, gelip tut elimden
Ya da düş benimle, ah

Ara, ara, ara
Doldu kalbim yara
Başa sara sara
Ara, ara, ara
Sanki en dipteyim, çıkar boğulmadan
Ara, ara, ara
Doldu kalbim yara
Başa sara sara
Ara, ara, ara
Sanki en dipteyim, çıkar boğulmadanEmbed","Search Lyrics

burns slowly
Don't let love
I passed out without you and drifted away
Is love to go and not come back?
Miss you like this?
Isn't there a happy ending?
Don't get shot and die, ah
Is there another way?
It does not listen to the voice of that longing, ""Shut up!"" as long as you say
I'm on the cliff, come and hold my hand
Or fall with me, ah

Search, search, search
My heart is full of wounds
back to sara
Search, search, search
It's like I'm at the bottom, get out without drowning
Search, search, search
My heart is full of wounds
back to sara
Search, search, search
It's like I'm at the bottom, get out without drowning

Will the pain decrease and hug the memories?
Tired of separation, the burden of separation has passed over me.
It's rewinding, why?
Not enough nights
As if the sun forgot to rise to us
Understand this ordeal, I went through this body while waiting for you again
Can't walk away when the heart is running out like this, breaking and falling out
You might also like
It does not listen to the voice of that longing, ""Shut up!"" as long as you say
I'm on the cliff, come and hold my hand
Or fall with me, ah

Search, search, search
My heart is full of wounds
back to sara
Search, search, search
It's like I'm at the bottom, get out without drowning
Search, search, search
My heart is full of wounds
back to sara
Search, search, search
It's like I'm at the bottom, get out without drowning",tr,"{'understand', 'away', 'hand', 'search', 'sara', 'walk', 'rise', 'wound', 'memory', 'long', 'night', 'happy', 'slowly', 'fall', 'went', 'ordeal', 'body', 'bottom', 'passed', 'miss', 'running', 'lyric', 'listen', 'sun', 'shut', 'tired', 'way', 'cliff', 'full', 'shot', 'drowning', 'die', 'falling', 'love', 'burden', 'hug', 'forgot', 'waiting', 'drifted', 'pain', 'separation', 'rewinding', 'doe', 'decrease', 'heart', 'back', 'hold', 'longing', 'voice', 'enough', 'breaking', 'burn', 'ending'}"
53,53,53,53,53,53,Dolu Kadehi Ters Tut,Yapma N'olursun,"Yapma N’olursun Lyrics

Ananas gibi, ahududu gibi
Ama daha çok avokado gibi tabii
Bunu ben bilirim, bir de benim gibileri
İnan ki, inan ki
Denedin bizi, ruhumun ikizi
Sandım aynı parmaklarımızın izi
Seni gördüğümde vurdu bi' kalp krizi
İnan ki, inan ki
Yaramaz kedi, yok ki tabii dili
Nası' söyler ki sana olanı biteni?
Yokluğunda kaldım ben bi' kemik, bi' deri
İnan ki, inan ki
Zor, çok zor

Yapma n'olursun, bırak o yerimi doldursun
Bana ihtiyacın olursa sarıl ona, elbet unutursun
Yapma n'olursun, bırak o yerimi doldursun
Bana ihtiyacın olursa sarıl ona, elbet unutursun

Dediler: ""Seni sordu yine biri
Kalbi masmavi denizler gibi""
Bunu duyduğumda ben öldüm bi' nevi
İnan ki, inan ki
Sıcacık teni, kıvrımlı beli
Nasıl unuturum ki boynundaki o beni?
Bunlar yine başımı döndürmemeli
Zor ki, inan ki
Dönemem geri, olmalıyım deli
Girmişse kalbine bambaşka biri
Hatırımda gittiğin gün dün gibi
İnan ki, inan ki
Zor, çok zor

Yapma n'olursun, bırak o yerimi doldursun
Bana ihtiyacın olursa sarıl ona, elbet unutursun
Yapma n'olursun, bırak o yerimi doldursun
Bana ihtiyacın olursa sarıl ona, elbet unutursun
Yapma n'olursun, bırak o yerimi doldursun
Bana ihtiyacın olursa sarıl ona, elbet unutursun
Yapma n'olursun, bırak o yerimi doldursun
Bana ihtiyacın olursa sarıl ona, elbet unutursunYou might also likeEmbed","Don't You Know Lyrics

Like pineapple, like raspberry
But more like avocado of course
I know that, and people like me
believe, believe that
You tried us, twin of my soul
I thought it was the same fingerprints
When I saw you hit a heart attack
believe, believe that
Naughty cat, no language of course
How does he tell you what's going on?
I'm left in your absence I'm a bone, a skin
believe, believe that
hard, very hard

Come on, please, let him fill my place
If you need me hug him, you will surely forget
Come on, please, let him fill my place
If you need me hug him, you will surely forget

They said: ""Someone asked about you again
His heart is like the deep blue sea""
I kind of died when I heard that
believe, believe that
Warm skin, curved waist
How can I forget that me on your neck?
These shouldn't make my head spin again
It's hard to believe
My period is back, I must be crazy
If someone else entered your heart
I remember the day you left like it was yesterday
believe, believe that
hard, very hard

Come on, please, let him fill my place
If you need me hug him, you will surely forget
Come on, please, let him fill my place
If you need me hug him, you will surely forget
Come on, please, let him fill my place
If you need me hug him, you will surely forget
Come on, please, let him fill my place
You might also likeEmbed",tr,"{'avocado', 'skin', 'else', 'deep', 'curved', 'bone', 'surely', 'crazy', 'cat', 'hit', 'fill', 'died', 'forget', 'pineapple', 'fingerprint', 'lyric', 'absence', 'period', 'saw', 'believe', 'thought', 'hard', 'people', 'attack', 'shouldnt', 'head', 'neck', 'hug', 'spin', 'entered', 'waist', 'please', 'must', 'yesterday', 'someone', 'left', 'remember', 'doe', 'tried', 'twin', 'heart', 'heard', 'back', 'language', 'warm', 'place', 'course', 'raspberry', 'sea', 'blue', 'naughty', 'asked', 'soul', 'kind'}"
54,54,54,54,54,54,Berkay Altunyay,Olmazlara İnat,"Olmazlara İnat Lyrics

(Segah)

Olmaz, hislerim aynı değil
Sana söyledim en başa dönmeliyiz
Zaman her düşe ters
Bir de sen gibi bakmıyor hiç bi’ beden
Yüzüme yağdırıp gözlerini
Canımı yakıyor ama yine sözler değil
Gösteri gibidir o boşverişi
Serseri bir iki biraz da deli
O her gece yıldızlarca güler
Deliler deli derdi halime
Onu gören bir anı da ben
O yarın olmasın istemem
Aynısı dün bi’ günün cürümü
Beni bi’ yakar ki yine zaman
Beni bana bırak

Olmazlara inat elimi tut
Bak bize zaman ilaç
Dünü unutup da bir oluruz yarına
Ya, bu yalana kim inanacak?
Olmazlara inat elimi tut
Bak bizе zaman ilaç
Dünü unutup da bir oluruz yarına
Ya, bu yalana kim inanacak?

Son günüm olur kendisi
Buruk bi’ nefisin oyunu
Bir de pis o huyu
Boş yеre durup bekleme
Durum sandığın kadarı değil hiç o
Demosu bu
Yüzüme yağdırıp gözlerini
Canımı yakıyor ama yine sözleri değil
Gösteri gibidir o boşver'i
Serseri biri ki biraz da deli
You might also like
O tüm gece yıldızlarca güler
Deliler deli derdi halime
Onu gören bir anıda ben
O yarın olmasın istemem
Aynısı dün bi’ günün cürümü
Beni bi’ yakar ki yine zaman
Beni bana bırak

Olmazlara inat elimi tut
Bak bize zaman ilaç
Dünü unutup da bir oluruz yarına
Ya, bu yalana kim inanacak?
Olmazlara inat elimi tut
Bak bize zaman ilaç
Dünü unutup da bir oluruz yarına
Ya, bu yalana kim inanacak?Embed","Worshipful Lyrics

(Segah)

No, my feelings are not the same
I told you we should go back to the beginning
Time is against every dream
And no body looks like you
Raining your eyes on my face
It hurts me but again not the words
It's like a show
punk one or two a little crazy
He smiles like stars every night
Crazy people call me crazy
One moment I saw him
I don't want it to be tomorrow
The same is the crime of a day yesterday
Time will burn me again
leave me to me

Hold my hand despite the impossible
Look at us time is medicine
We forget yesterday and become one for tomorrow
Who will believe this lie?
Hold my hand despite the impossible
Look when we're medicine
We forget yesterday and become one for tomorrow
Who will believe this lie?

It will be my last day
The game of a bitter soul
And that bad habit
Don't wait in vain
The situation is not as much as you think it is.
This is the demo
Raining your eyes on my face
It hurts me but again not the words
It's like a show, never mind
A vagrant who's a little crazy
You might also like
She laughs at the stars all night
Crazy people call me crazy
When I see him
I don't want it to be tomorrow
The same is the crime of a day yesterday
Time will burn me again
leave me to me

Hold my hand despite the impossible
Look at us time is medicine
We forget yesterday and become one for tomorrow
Who will believe this lie?
Hold my hand despite the impossible
Look at us time is medicine
We forget yesterday and become one for tomorrow
Ya, who will believe this lie? Embed",tr,"{'hand', 'beginning', 'look', 'bad', 'tomorrow', 'punk', 'night', 'call', 'eye', 'little', 'crazy', 'body', 'forget', 'dream', 'medicine', 'vain', 'lyric', 'moment', 'bitter', 'mind', 'habit', 'two', 'saw', 'impossible', 'believe', 'feeling', 'become', 'people', 'laugh', 'worshipful', 'raining', 'face', 'star', 'demo', 'crime', 'yesterday', 'despite', 'smile', 'game', 'wait', 'segah', 'time', 'hurt', 'word', 'lie', 'back', 'hold', 'vagrant', 'show', 'last', 'told', 'leave', 'burn', 'soul', 'situation'}"
55,55,55,55,55,55,No.1,Yarım Kalan Sigara,"Yarım Kalan Sigara Lyrics

Simsiyah bir gecenin
Öfkesiydi sözlerin
Hayat, kırmadan anlat isterim
Yarım kalan sigara, boş şişeyle yan yana
Onlar arkadaş şimdi bana
Simsiyah bir gecenin
Öfkesiydi sözlerin
Hayat, kırmadan anlat isterim
Yarım kalan sigara, boş şişeyle yan yana
Onlar arkadaş şimdi bana (Ah)
Yarım kaldık, bence sen yat artık
Çamur rengi köpekler, üstü karla kaplı
Kiralar pahalı diye ölmek istiyoruz çünkü şeytan bize cehennemden boş bi' arsa sattı
Yarım kaldık, saçmalama artık
Ben gecenin gürültüsü sen de noise reduction
Bir gram ayık değildim onca çakala karşı
Cut yapınca beat'i, sözüm punch olmuyor artık
Yarım kalsın, gözlerin kararsın
Sen de gitmek istiyorsan tilkiler utansın
Bak ne hâle geldik, bilmeseydik keşke
Keşke çocuklar ölmese elinde keleşle
Yarım kaldık, sen de anla artık
Boş bi' kalbe ne sığdırdık, midemde hep ağrı
Şişeler izmarit dolunca gün ağardı, yattık
Bir uçaktık düştük, bir gemiydik battık

Simsiyah bir gecenin
Öfkesiydi sözlerin
Hayat, kırmadan anlat isterim
Yarım kalan sigara, boş şişeyle yan yana
Onlar arkadaş şimdi banaYou might also like6Embed","The Unfinished Cigarette Lyrics

of a pitch black night
Your anger was your words
Life, I want to tell without breaking
Unfinished cigarette side by side with an empty bottle
They are friends now me
Black of a night
Your anger was your words
Life, I want to tell without breaking
Unfinished cigarette, side by side with an empty bottle
They're friends to me now (Ah)
We're halfway done, I think you sleep now
Mud-coloured dogs, covered with snow
We want to die because rents are expensive, because the devil sold us an empty plot from hell.
We're halfway done, don't be silly anymore
I am the noise of the night and you are noise reduction.
I wasn't sober one ounce against all the coyotes
When you cut the beat, my word is not punch anymore
Let it be half, let your eyes black
If you want to go too, let the foxes be ashamed.
Look what we've become, if only we didn't know
I wish the children didn't die
We're halfway through, understand now
What did we fit in an empty heart, always pain in my stomach
It was daybreak when the bottles were full of butts, we went to bed
We were a plane we crashed we were a ship we sank

of a pitch black night
Your anger was your words
Life, I want to tell without breaking
Unfinished cigarette side by side with an empty bottle
You might also like6Embed",tr,"{'understand', 'ounce', 'butt', 'theyre', 'life', 'look', 'side', 'friend', 'punch', 'plot', 'empty', 'beat', 'unfinished', 'night', 'half', 'wish', 'eye', 'hell', 'rent', 'black', 'went', 'pitch', 'coyote', 'lyric', 'fox', 'daybreak', 'noise', 'stomach', 'sank', 'full', 'bottle', 'plane', 'sleep', 'crashed', 'become', 'die', 'silly', 'sold', 'sober', 'expensive', 'weve', 'pain', 'bed', 'cut', 'halfway', 'reduction', 'mudcoloured', 'wasnt', 'ship', 'snow', 'covered', 'heart', 'word', 'child', 'dog', 'devil', 'fit', 'breaking', 'ashamed', 'anger', 'cigarette'}"
56,56,56,56,56,56,Cem Adrian,Kül,"Kül Lyrics

İçimde bir şey kanıyor
Keskin bir vedanın yarası sızlıyor
Yüzümde bir şey soluyor
Aynı değil, umudun rengi kayboluyor

Kalbimde bir yerde bir orman yanıyor
Bıraktığın şarkılar sahipsiz susuyor
Şiirler hep dargın, dualar şifasız
Ömrüme mıhlanmış bir cümle
Kül olur kalbindeki zamanla
Yana yana, yana yana
Yana yana, yana yana
Kül olur kalbindeki zamanla
Yana yana, yana yana
Yana yana, yana yana
Kül olur kalbindeki zamanla
Yana yana, yana yana
Yana yana, yana yana
Kül olur kalbindeki zamanla
Yana yana, yana yana, yana
Kül olur kalbindeki zamanla
Yana yana, yana yana
Yana yana
Kül olur kalbindeki zamanla
Yana yana, yana yana
Yana yana, yana
Kül olur kalbindeki zamanla
Yana yana, yana yana
Yana yana, yana yana
Kül olur kalbindeki zamanla
Yana yana, yana yana
Yana yana, yana yana

(Kül olur kalbindeki zamanla)
(Yana yana, yana yana)
(Yana yana)
(Kül olur kalbindeki zamanla)
(Yana yana, yana yana)
(Yana yana)
(Kül olur kalbindeki zamanla)
(Yana yana, yana yana)
(Yana yana)
(Kül olur kalbindeki zamanla)
(Yana yana, yana yana)
(Yana yana)You might also like1Embed","Ash Lyrics

Something inside me is bleeding
The wound of a sharp farewell aches
Something is fading on my face
It's not the same, the color of hope is fading

Somewhere in my heart a forest is burning
The songs you left are silent
Poems are always offended, prayers are incurable
A sentence stuck in my life
Your heart turns to ash with time
Side by side, side by side
Side by side, side by side
Your heart turns to ash with time
Side by side, side by side
Side by side, side by side
Your heart turns to ash with time
Side by side, side by side
Side by side, side by side
Your heart turns to ash with time
Side by side, side by side, side by side
Your heart turns to ash with time
Side by side, side by side
side by side
Your heart turns to ash with time
Side by side, side by side
sideways, sideways
Your heart turns to ash with time
Side by side, side by side
Side by side, side by side
Your heart turns to ash with time
Side by side, side by side
Side by side, side by side

(It turns to ash in your heart with time)
(Side by side, side by side)
(Side by side)
(It turns to ash in your heart with time)
(Side by side, side by side)
(Side by side)
(It turns to ash in your heart with time)
(Side by side, side by side)
(Side by side)
(It turns to ash in your heart with time)
(Side by side, side by side)
(Side by side) You might also like1Embed",tr,"{'sideways', 'fading', 'life', 'side', 'wound', 'bleeding', 'farewell', 'forest', 'sharp', 'inside', 'prayer', 'sentence', 'song', 'lyric', 'hope', 'somewhere', 'burning', 'poem', 'ash', 'face', 'offended', 'turn', 'silent', 'left', 'stuck', 'heart', 'time', 'incurable', 'ache', 'color'}"
57,57,57,57,57,57,Sefo,Tutsak,"Tutsak Lyrics

Ya, Sefo-o-o

Gümüş gerdanında tutsaktı, ben ellerinde
Mükemmel bi' film tadında
Hatta gözlerimin önünde
Bana göre biri var (Oh)
Kabul, delice (Ey)
Ona haber veriyo' (Oh)
O gün gelicek, ey
Dilime dolandın
Dilim dile gelip dedi ""Eyvah!""
Bilemedi, n'apiyim?
Şu an konuşmanın ne gereği var?
Göremedim saati
Akıyo' geçiyo' kafa leyla, oh-wow
Tamam ama daha değil
Sanki yaşıyorum bi' deneyi, ya, ey
Tamam, sen özledin, yeter
Gözlerin bana bunu söyler, ya
Bu söz sana değil, genel
""Olmaz olsun"" dersin de döner ya
Daha da neler ya başımıza!
Seni ben bilirim, beni sen, gidiyorsan git
Ateşini ver, derdime denk, yok merhamet hiç
Yansın tabii, kül olsun, 'un, 'un
Çare aramadım, oof
Senden gelecek
İçime atamadım, oof

Gümüş, gerdanında tutsaktı, ben ellerinde
Mükemmel bi' film tadında
Hatta gözlerimin önünde
Bana göre biri var
Kabul, delice
Ona haber veriyo'
O gün gelicek, ey
You might also like
Kime ne? Bu ne sorular?
Dedikodular, yine yorulan o
Bana ne? Basit konular
Haset dolular, e bana zoru var, wow
Her işin bi' yolu var
Dönerim deliye ki o da biliyor, wow-wow
Nedir adı konulan?
Göremem önümü de bunu seviyor, wow-wow
Benim sıkıntım inat, sorma bana ""Niye?""
Konulur tanılar, Tanrı'dan hediye
Kabul ediyorum, yıllarım saniye gibi geçiyo'
Durumumu korumam iyi
Sizin açınızdan hiç sıkıntı değil
Ne varsa kaçılan, o başına gelir
Olursun acınan, küçümsenen biri
Kısaca ""Deli""

Gümüş, gerdanında tutsaktı, ben ellerinde
Mükemmel bi' film tadında
Hatta gözlerimin önünde
Bana göre biri var
Kabul, delice
Ona haber veriyo'
O gün gelicek, eyEmbed","Prisoner Lyrics

Ya, Sefo-o-o

Captive in your silver neck, I'm in your hands
Tastes like a perfect movie.
even before my eyes
There's someone for me (Oh)
Agree, crazy (O)
Letting her know' (Oh)
That day will come, oh
you got on my tongue
My tongue spoke up and said, ""Alas!""
He didn't know, what am I?
What's the point of talking right now?
I couldn't see the clock
Flowing 'passing' head leyla, oh-wow
ok but not yet
It's like I'm living an experiment, ya, ey
Ok, you missed it, enough
Your eyes tell me that, ya
This word is not for you, but for the general
If you say ""no way"" it will come back
What else is wrong with us!
I know you, me you, go if you're going
Give me your fire, equal to my trouble, no mercy at all
Let it burn, of course, become ashes, 'un, 'un
I didn't look for a cure, oof
It will come from you
I couldn't put it in, oof

Silver was captive in your neck, I'm in your hands
Tastes like a perfect movie.
even before my eyes
There is one for me
Agree, crazy
I'm informing him
That day will come, oh
You might also like
Who what? What questions are these?
Rumors that he's tired again
What about me? simple matters
They're full of envy, so it's hard on me, wow
Everything has a way
I'm going crazy that she knows, wow-wow
What is named?
I can't see, she likes it, wow-wow
My trouble is stubborn, don't ask me ""Why?""
Diagnoses are made, gift from God
I admit, my years pass like seconds
I'm good at keeping my status
No problem for you
Whatever is escaped, it happens to you
Become a pitiful, despised person
""Crazy"" for short

Silver was captive in your neck, I'm in your hands
Tastes like a perfect movie.
even before my eyes
There is one for me
Agree, crazy
I'm informing him
That day will come, eyEmbed",tr,"{'hand', 'short', 'simple', 'god', 'letting', 'talking', 'clock', 'eye', 'named', 'experiment', 'lyric', 'wow', 'tired', 'hard', 'become', 'point', 'year', 'question', 'stubborn', 'keeping', 'problem', 'silver', 'escaped', 'back', 'ohwow', 'else', 'good', 'despised', 'flowing', 'ala', 'fire', 'passing', 'perfect', 'gift', 'happens', 'way', 'cure', 'diagnosis', 'second', 'agree', 'person', 'captive', 'word', 'matter', 'burn', 'theyre', 'leyla', 'look', 'status', 'right', 'crazy', 'rumor', 'full', 'missed', 'equal', 'taste', 'mercy', 'neck', 'ash', 'trouble', 'general', 'course', 'enough', 'pitiful', 'wrong', 'movie', 'ask', 'sefooo', 'made', 'wowwow', 'tongue', 'spoke', 'head', 'informing', 'prisoner', 'envy', 'pas', 'living', 'admit', 'oof', 'someone', 'whatever'}"
