,Unnamed: 0,Unnamed: 0.1,Unnamed: 0.1.1,Unnamed: 0.1.1.1,Unnamed: 0.1.1.1.1,Artist,Title,Lyrics,Translations,Languages,Processed translations
0,0,0,0,0,0,Madrigal,Seni Dert Etmeler,"TranslationsEnglishSeni Dert Etmeler Lyrics

Bazen bana gelir, gider
Seni dert etmeler
Seni rüyalarımda hapsetmeler
Yıldızların hırsızları mı var?
Tutamam, tutamam
Hep yeni bir gün doğar

Başka bi' evrende, en güzel hâlinle
Sen hayata karış, ben daha da biteceğim
Kırgınım kendime
Üşüyorum gölgende
Henüz bilmesen de
Belki bir gün gid'iceğim
Hiç gerek yok daha fazlasına
Zamanı tutmaya, fezaya uçmaya
Geride kaldılar (Geride kaldılar)
Geride kaldı o günler
Sen varken taptığım kasvetli şehirler

Başka bi' evrende, en güzel hâlinle
Sen hayata karış, ben daha da biteceğim
Kırgınım kendime
Üşüyorum gölgende
Henüz bilmesen de
Belki bir gün gid'iceğim


Başka bi' evrende, en güzel hâlinle
Sen hayata karış, ben daha da biteceğim
Kırgınım kendime
Üşüyorum gölgende
Henüz bilmesen de
Belki bir gün gid'iceğimYou might also like1Embed","TranslationsEnglish Don't Worry About You Lyrics

Sometimes it comes to me and goes
don't worry about you
Don't trap you in my dreams
Do the stars have thieves?
I can't hold, I can't hold
A new day always rises

In another 'universe', in your most  beautiful form
You get involved in life, I'll end up even more
I'm angry with myself
I'm cold in your shade
Even if you don't know yet
Maybe one day I'll go
No need for more
To keep time, to fly into space
They're behind (They're behind)
Gone are those days
The gloomy cities that I adore with you

In another universe, at your best
You get involved in life, I will end even more
I'm angry with myself
I'm cold in your shade
Even if you don't know yet
Maybe one day I'll go


In another universe, at your best
You get involved in life, I will end even more
I'm angry with myself
I'm cold in your shade
Even if you don't know yet
You might also like1Embed",tr,"{'theyre', 'behind', 'life', 'beautiful', 'fly', 'gloomy', 'rise', 'maybe', 'new', 'shade', 'dream', 'translationsenglish', 'lyric', 'involved', 'gone', 'thief', 'cold', 'form', 'universe', 'best', 'star', 'keep', 'adore', 'angry', 'space', 'trap', 'end', 'time', 'hold', 'worry', 'city'}"
1,1,1,1,1,1,KÖFN,Bi' Tek Ben Anlarım,"Bi’ Tek Ben Anlarım Lyrics

Teninin üzerinden kayan bi' buzdur uzak bakışlarım
Hiç izlememiş olsaydım bu filmi canımı acıtırdı

Ama seni bilmek, seni bilmek
Seni bilmek beynimde bi kurşun
Seni bilmek, seni bilmek
Seni bilmek en büyük ceza
Her anın aklımda, her kıvrımın
Sanmasınlar asla seni benden ayrı
Savrulur savrulur saçlarında hayatın
Seni sorsunlar benden, bi' tek ben anlarım
Her anın aklımda, her kıvrımın
Sanmasınlar asla seni benden ayrı
Savrulur savrulur saçlarında hayatın
Seni sorsunlar benden, bi' tek ben anlarım

Teninin üzеrinden kayan bi' buzdur uzak bakışlarım
Hiç izlememiş olsaydım bu filmi canımı acıtırdı

Ama sеni bilmek, seni bilmek
Seni bilmek beynimde bi kurşun
Seni bilmek, seni bilmek
Seni bilmek en büyük ceza

Her anın aklımda, her kıvrımın
Sanmasınlar asla seni benden ayrı
Savrulur savrulur saçlarında hayatın
Seni sorsunlar benden, bi' tek ben anlarım
Her anın aklımda, her kıvrımın
Sanmasınlar asla seni benden ayrı
Savrulur, savrulur saçlarında hayatın
Seni sorsunlar benden, bi' tek ben anlarımYou might also like1Embed","I'm The Only One Lyrics

My distant gaze is ice sliding over your skin
If I had never watched this movie it would hurt me

But to know you, to know you
Knowing you is a bullet in my brain
to know you, to know you
Knowing you is the greatest punishment
Every moment on my mind, every curve of yours
Let them never think you apart from me
Your life is tossed in your hair
Let them ask about you, only I can understand
Every moment on my mind, every curve of yours
Let them never think you apart from me
Your life is tossed in your hair
Let them ask about you, only I can understand

My distant gaze is ice sliding over your skin
If I had never watched this movie it would hurt me

But to know you, to know you
Knowing you is a bullet in my brain
to know you, to know you
Knowing you is the greatest punishment

Every moment on my mind, every curve of yours
Let them never think you apart from me
Your life is tossed in your hair
Let them ask about you, only I can understand
Every moment on my mind, every curve of yours
Let them never think you apart from me
It sways, sways in your hair
You might also like1Embed",tr,"{'understand', 'movie', 'ask', 'brain', 'life', 'curve', 'skin', 'bullet', 'sway', 'watched', 'tossed', 'lyric', 'ice', 'apart', 'moment', 'hair', 'distant', 'sliding', 'gaze', 'punishment', 'greatest', 'hurt', 'knowing', 'mind'}"
2,2,2,2,2,2,Yüzyüzeyken Konuşuruz,Dinle Beni Bi',"Dinle Beni Bi’ Lyrics

Tut elimi buradan gidelim
Olmaz demeden dinle beni bi'
Rüzgarım söndü, dindi ateşim
Ah, bebeğim ben hâlâ deliyim

Sen yokken ne gece ne de gündüz
Ne ay var ne tek bi' yıldız
Her yer karanlık ve ıssız
Göremiyorum
Sen yokken ne gece ne de gündüz
Ne ay var ne tek bi' yıldız
Her yer karanlık ve ıssız
Göremiyorum
Tut elimi buradan gidelim
Olmaz demeden dinle beni bi'
Rüzgarım söndü, dindi ateşim
Ah, bebeğim ben hâlâ deliyim

Sen yokken ne gece ne de gündüz
Ne ay var ne tek bi' yıldız
Her yer karanlık ve ıssız
Göremiyorum
Sen yokken ne gece ne de gündüz
Ne ay var ne tek bi' yıldız
Her yer karanlık ve ıssız
GöremiyorumYou might also like5Embed","Listen to Me Bi' Lyrics

Take my hand let's get out of here
Listen to me without saying no
My wind is out, my fire is gone
Oh baby I'm still crazy

Neither night nor day when you are gone
There is neither a moon nor a single star
Everywhere is dark and desolate
I can not see
Neither night nor day when you are gone
There is neither a moon nor a single star
Everywhere is dark and desolate
I can not see
Take my hand let's get out of here
Listen to me without saying no
My wind is out, my fire is gone
Oh baby I'm still crazy

Neither night nor day when you are gone
There is neither a moon nor a single star
Everywhere is dark and desolate
I can not see
Neither night nor day when you are gone
There is neither a moon nor a single star
Everywhere is dark and desolate
You might also like5Embed",tr,"{'hand', 'everywhere', 'single', 'lyric', 'gone', 'dark', 'listen', 'star', 'night', 'wind', 'moon', 'fire', 'desolate', 'crazy', 'neither'}"
3,3,3,3,3,3,Evdeki Saat,Uzunlar,"Uzunlar (V2) LyricsHislerim yok bütün, ne bir sevinç ne bir hüzün
Gitgide iki yüzüm birbirine bulaşıyor
Bana bir bak yüz beşerim
Dedi hayat düzleşelim
Peki tamam yüzleşelim yesem ne kadarı ulaşıyor
Uykusunda her biri
Yorma sakın kendini
Anlatıp derdimizi onlara
Sen ben birkaç kişi
Bırakmışız bütün işi
Vurmuşuz kendimizi yollara
Uzunlar yanıyor arabamızda
Bu ışık hepimize fazla
Geceyi böler
Bilmem ne olabilir aramızda
Bu ışık ikimize fazla
Arayı bozar
Uzunlar yanıyor arabamızda
Bu ışık hepimize fazla
Geceyi böler
Bilmem ne olabilir aramızda
Bu ışık ikimize fazla
Arayı bozar
Kaderimin inceden nefesinin dokunuşu
Ederini bilmeden hevesimin yok oluşu
Hadi bugün pisleşelim dedi hayat yozlaşalım
Peki tamam uzlaşalım desem ne kadarı ulaşıyor?
Uykusunda her biri
Yorma sakın kendini
Anlatıp derdimizi onlara
Sen ben birkaç kişi
Bırakmışız bütün işi
Vurmuşuz kendimizi yollara
You might also likeUzunlar yanıyor arabamızda
Bu ışık hepimize fazla
Geceyi böler
Bilmem ne olabilir aramızda
Bu ışık ikimize fazla
Arayı bozar
Uzunlar yanıyor arabamızda
Bu ışık hepimize fazla
Geceyi böler
Bilmem ne olabilir aramızda
Bu ışık ikimize fazla
Arayı bozarEmbed","Talls (V2) LyricsI have no feelings at all, neither joy nor sadness
More and more my two faces are getting mixed up
Take a look at me hundred human
Said life let's get straight
Well ok let's face it, how much does it reach if I eat it?
In his sleep each
Don't tire yourself
Tell them our troubles
you me a few people
We left all the work
We hit  ourselves roads
The tall ones are burning in our car
This light is too much for all of us
divides the night
I don't know what could happen between us
This light is too much for both of us
break up
The tall ones are burning in our car
This light is too much for all of us
divides the night
I don't know what could happen between us
This light is too much for both of us
break up
The touch of my destiny's thin breath
The disappearance of my enthusiasm without knowing its worth
He said let's get dirty today life said let's get dirty
Well, if I say okay let's compromise, how much does it reach?
each in his sleep
Don't tire yourself
Tell them our troubles
you me a few people
We left all the work
We hit the roads ourselves
You might also like
This light is too much for all of us
divides the night
I don't know what could happen between us
This light is too much for both of us
break up
The tall ones are burning in our car
This light is too much for all of us
divides the night
I don't know what could happen between us
This light is too much for both of us
Breaks the gapEmbed",tr,"{'enthusiasm', 'look', 'life', 'tall', 'reach', 'work', 'dirty', 'straight', 'well', 'night', 'destiny', 'gap', 'hundred', 'eat', 'disappearance', 'hit', 'touch', 'divide', 'mixed', 'worth', 'two', 'sleep', 'burning', 'feeling', 'car', 'people', 'sadness', 'today', 'face', 'trouble', 'thin', 'tire', 'compromise', 'breath', 'human', 'left', 'happen', 'doe', 'joy', 'knowing', 'light', 'lyricsi', 'break', 'road', 'neither'}"
4,4,4,4,4,4,UZI,ARASAN DA,"TranslationsEnglishARASAN DA Lyrics

Unuttum seni
(Kaleen)

Arasan da beni çok geç
Kaldı heveslerim kursağımda
Lütfen uzatma, yolum yol değil
Ölüm on beş adımlık uzakta
Arasan da beni, yok yüzüm
Söyliy'cek sözüm, artık çok geç
Lütfen uzatma, ya (Uh, u-uh)
(Lütfen uzatma, ey)
Gülün, yokmuş gibi yarın, sanki yokmuş gibi ölüm
Tokmuş gibi karnın, solmuş sanki çiçeklerin
Doluyo'sa iki cümleye de iki gözün
Nefretini yen, dön'ceğin kapı da benim
Hayatımda yalnız olmak kalıcı tek çözüm
Ama şu an ihtiyacım olan para değil
Hayatımız dizi madem, bu kaçıncı bölüm?
Silahını orospu çocuklarına çevir

Karşılaşmak çok zor, gördüğün aynadan kaçmak, daha fazla delir
Yabancılaştım resmen, bıraktım kadere, inanırım, elbet gelir
Çok yorgun düştüm (Ya), bir gece karşımda belir (Ya)

Arasan da beni çok geç
Kaldı heveslerim kursağımda
Lütfen uzatma, yolum yol değil
Ölüm on beş adımlık uzakta
Arasan da beni, yok yüzüm
Söyliy'cek sözüm, artık çok geç
Lütfen uzatma, ya
(Uh, u-uh)

Gelme, bana istediğimi verme
Derme çatma hayallerimize perde çektim
Yaşıyorum mutlu olduğumuz günlerde
Madem böyle oluca'z o zaman hiç güvenme bana ve düştüm sana
Bi' kez daha valla' kaçar giderim birden bire
Kader sorarsa sana görmedin beni, düşemem daha dilden dile
Büyüdüm, dert ekledikçe izledim ve güldüm
Utandım iyice; ""Dur..."" dedim, ""...be Chavo büyüdün""
Umarım seni beyazlar içinde görürüm
O zaman gerçekleşir beklediğin ölümüm
Allah'ınız para; ciğerlerim is, ciğerlerim kara
Yanılmadım çünkü harbi güvenmedim sana
Umut değil, lütfen artık silah verin bana
Gözlerim kara
You might also like
Karşılaşmak çok zor, gördüğün aynadan kaçmak, daha fazla delir
Yabancılaştım resmen, bıraktım kadere, inanırım, elbet gelir
Çok yorgun düştüm (Ya), bir gece karşımda belir (Ya)

Arasan da beni çok geç
Kaldı heveslerim kursağımda
Lütfen uzatma, yolum yol değil
Ölüm on beş adımlık uzakta
Arasan da beni, yok yüzüm
Söyliy'cek sözüm, artık çok geç
Lütfen uzatma, ya
(Lütfen uzatma, ey)

Karşılaşmak çok zor, gördüğün aynadan kaçmak, daha fazla delir
Elbet gelir, bir gece karşımda belir
(Uh, u-uh)5Embed","TranslationsEnglishARASAN DA Lyrics

I forgot you
(Kaleen)

It's too late to call me
My enthusiasm is left in my crop
Please don't stretch, my way is not the way
Death is fifteen feet away
Even if you call me, my face is gone
My word to say, it's too late now
Please don't stretch, ya (Uh, u-uh)
(Please don't stretch, ey)
Laugh like there's no tomorrow, like there's no death
As if your stomach is full, as if your flowers have faded
If it's Doluyo, you have two eyes for both sentences.
Beat your hate, I'm the door you will return to
Being alone in my life is the only permanent solution
But it's not the money I need right now
If our life is a series, which episode is this?
Turn your gun on motherfuckers

It's so hard to meet, run away from the mirror you see, the more you go crazy
I'm officially alienated, I left fate, I believe, of course it will come
I'm so tired (Ya), you show up one night (Ya)

It's too late to call me
My enthusiasm is left in my crop
Please don't stretch, my way is not the way
Death is fifteen feet away
Even if you call me, my face is gone
My word to say, it's too late now
Please don't extend it
(Uh, u-uh)

Don't come, don't give me what I want
I drew a curtain on our makeshift dreams
I live in the days when we are happy
If we're going to be like this then don't ever trust me and I fell for you
Once again, I'll run away suddenly
If fate asks you, you didn't see me, I can't fall
I grew up, watched and laughed as I added trouble
I was thoroughly embarrassed; ""Wait..."" I said, ""...you've grown up Chavo""
I hope to see you in white
Then the death you've been waiting for will come true
Your God is money; my lungs are soot, my lungs are black
I wasn't wrong because I didn't really trust you
No hope, please give me a gun now
my eyes are black
You might also like
It's so hard to meet, run away from the mirror you see, the more you go crazy
I'm officially alienated, I left fate, I believe, of course it will come
I'm so tired (Ya), you show up one night (Ya)

It's too late to call me
My enthusiasm is left in my crop
Please don't stretch, my way is not the way
Death is fifteen feet away
Even if you call me, my face is gone
My word to say, it's too late now
Please don't extend it
(Please don't stretch, ey)

It's so hard to meet, run away from the mirror you see, the more you go crazy
Surely it will come, one night it will appear before me
(Uh, u-uh)5Embed",tr,"{'stretch', 'door', 'god', 'extend', 'eye', 'hate', 'dream', 'lyric', 'hope', 'stomach', 'tired', 'two', 'live', 'hard', 'embarrassed', 'waiting', 'forgot', 'fell', 'soot', 'lung', 'permanent', 'left', 'show', 'white', 'enthusiasm', 'life', 'mirror', 'tomorrow', 'grew', 'laughed', 'surely', 'watched', 'alone', 'gone', 'kaleen', 'way', 'faded', 'suddenly', 'series', 'appear', 'trust', 'solution', 'gun', 'please', 'run', 'grown', 'word', 'episode', 'fate', 'makeshift', 'flower', 'officially', 'added', 'crop', 'beat', 'night', 'right', 'crazy', 'black', 'sentence', 'late', 'true', 'drew', 'full', 'return', 'uuh', 'face', 'trouble', 'asks', 'thoroughly', 'death', 'wasnt', 'money', 'wait', 'curtain', 'doluyo', 'course', 'chavo', 'fifteen', 'wrong', 'away', 'translationsenglisharasan', 'call', 'happy', 'meet', 'fall', 'foot', 'believe', 'alienated', 'laugh', 'turn', 'motherfucker'}"
5,5,5,5,5,5,UZI,PAPARAZZİ,"PAPARAZZI Lyrics

(Who made it? It's Kleo)
(Segah)

Yalan oluca'z, hızla gidersek
Her kapıyı çalana ""Gir içeri"" dersek (Ah)
Yoldan çıkıca'z, böyle seversek
Ciğerleri kedilere mundar edersek (Ya)
Buluca'z biz de çıkış yolu
Önümüzü gör'cek şekilde içersek (Ey-ey, ey-ey)
Artık vakit az, bi' karar mı versek?
Uyuyamam düşmanımdan tek bi' sayı yersek
Haram para ve lanet
Annem, sen bize dua et
Pişmanım çok geçmiştеn
Kaderim Tanrı'ya emanet
Kurtulamıyorum hiç rap'tеn
Başımı kaldıramıyorum içmekten (Ya)
Düştüm mahalleme yüksekten, yüksekten (Ya-ya)
Sonuna kadar
Gidice'm yolun sonuna kadar
Manitalar paparazzi gibi yakalar
Baba, für die Familie, sadece aile
Sonuna kadar
Gidice'm yolun sonuna kadar
Manitalar paparazzi gibi yakalar
Baba, für die Familie, sadece aile

Kur-tul-dum dertten
Sadece içip hayal kurardım
Kur-tul-dum senden
Görüceğim güne günler sayardım
""Kur-tul-dum"" derken
Daha daha dibe, daha dibe battım
Kur-tul-dum baba

İki güç de bi' arada
Şöhret yakışıyo' bize, bi' de para
Ölme, ara ver cano biralara
Keko mu, dızo mu? Chavo bi' numara
Yeah, yirmi yıl geçti, bu gençliğim fukara
Maalesef bulaşmayan kalmadı bu kana
Ellerim titredi, çıkamadım komadan
İçimdeki ses dedi: ""Vazgeç""
Eskiden olsa selam vermezdin
Ayrıl peşimden, artık maymun gözü açtı
Dişimden, tırnağımdan bu müziğe verdim
Emeğimin getirisi ölene dek harçlık (Harçlık)
You might also like
Kaçtık mı sandın? Koştum, kazandım
Ben çok kez inandım ve çoktum, azaldım
Boşlukta kaldım, yardım et Tanrım
Bu resmen bi' salgın ve farkına vardım

Sonuna kadar
Gidice'm yolun sonuna kadar
Manitalar paparazzi gibi yakalar
Baba, für die Familie, sadece aile
Sonuna kadar
Gidice'm yolun sonuna kadar
Manitalar paparazzi gibi yakalar
Baba, für die Familie, sadece aile

Kur-tul-dum dertten
Sadece içip hayal kurardım
Kur-tul-dum senden
Görüceğim güne günler sayardım
""Kur-tul-dum"" derken
Daha daha dibe, daha dibe battım
Kur-tul-dum baba1Embed","PAPARAZZI Lyrics

(Who made it? It's Kleo)
(Segah)

We'll lie, if we go fast
If we say ""Come in"" to every knocker (Ah)
We'll get out of the way, if we love like this
If we purge the lungs for cats (What if)
Buluca'z we are the way out
If we drink to see ahead (Ey-ey, ey-ey)
Time is short now, shall we make a decision?
I can't sleep if we eat a single number from my enemy
Forbidden money and curse
Mom, you pray for us
I'm sorry it's too late
My fate is entrusted to God
I can't get rid of rap
I can't lift my head from drinking (Ya)
I fell into my neighborhood from high, high (Ya-ya)
Till the end
My Gidice to the end of the road
Girlfriends catch like paparazzi
Dad, für die Familie, just family
Till the end
My Gidice to the end of the road
Girlfriends catch like paparazzi
Dad, für die Familie, just family

Kur-tul-dum from trouble
I was just drinking and dreaming
Kur-tul-dum from you
I count the days until the day I see you
When you say ""Kur-tul-dum""
I've sunk deeper, deeper
Kur-tul-dum dad

Two powers together
Fame suits us, and money
Don't die, take a break from canoes
Keko or dizo? Chavo is number one
Yeah, it's been twenty years, my youth is poor
Unfortunately, there is no one left to this blood.
My hands were shaking, I couldn't get out of my coma
The voice inside me said: ""Give it up""
You wouldn't have said hello before
Go away, now the monkey's eyes are open
I gave my tooth and nail to this music
The return of my labor is pocket money until I die (More pocket money)
You might also like
Did you think we ran away? I ran, I won
I believed too many times and I was too much, too low
I'm stuck in the void, help me God
It's officially an epidemic and I've realized

Till the end
My Gidice to the end of the road
Girlfriends catch like paparazzi
Dad, für die Familie, just family
Till the end
My Gidice to the end of the road
Girlfriends catch like paparazzi
Dad, für die Familie, just family

Kur-tul-dum from trouble
I was just drinking and dreaming
Kur-tul-dum from you
I count the days until the day I see you
When you say ""Kur-tul-dum""
I've sunk deeper, deeper
Kur-tul-dum baba1Embed",tr,"{'void', 'deeper', 'hand', 'short', 'god', 'blood', 'eye', 'curse', 'girlfriend', 'lyric', 'drinking', 'two', 'purge', 'paparazzo', 'canoe', 'coma', 'year', 'family', 'keko', 'love', 'fast', 'fell', 'low', 'lung', 'entrusted', 'left', 'pocket', 'catch', 'eyey', 'familie', 'hello', 'mom', 'bulucaz', 'für', 'decision', 'eat', 'rap', 'help', 'cat', 'inside', 'epidemic', 'music', 'nail', 'neighborhood', 'wouldnt', 'way', 'many', 'number', 'drink', 'dreaming', 'poor', 'kleo', 'labor', 'knocker', 'monkey', 'fate', 'voice', 'yaya', 'officially', 'realized', 'believed', 'baba', 'pray', 'enemy', 'well', 'unfortunately', 'late', 'single', 'youth', 'ahead', 'sleep', 'return', 'till', 'high', 'suit', 'die', 'trouble', 'money', 'stuck', 'segah', 'end', 'lie', 'dizo', 'twenty', 'chavo', 'road', 'dad', 'together', 'away', 'count', 'ran', 'made', 'shall', 'tooth', 'sunk', 'gidice', 'sorry', 'head', 'lift', 'power', 'fame', 'gave', 'kurtuldum', 'time', 'forbidden', 'rid', 'open', 'break', 'shaking'}"
6,6,6,6,6,6,mor ve ötesi,Bir Derdim Var,"Bir Derdim Var Lyrics

Bir derdim var, artık tutamam içimde
Gitsem nereye kadar?
Kalsam neye yarar?
Hiç anlatamadım
Hiç anlamadılar

Herkes neden düşman?
Herkes neden düşman?
Unuttuk hepsini, Nuh'un nefesini
Gelme yanıma; sen başkasın, ben başka

Bir derdim var, artık tutamam içimde
Gitsem nereye kadar?
Kalsam neye yarar?
Hiç anlatamadım
Hiç anlamadılar

Bak, bu son perde
Oyun yok bundan sonra
Işık yok, hiçbir şey yok
Yok, yok, yok

Bir derdim var
Bir derdim var
Bir derdim var
Bir derdim var
Bir derdim var
Bir derdim var tutamam içimde

Bir derdim var, artık tutamam içimdeYou might also like5Embed","I Have A Problem Lyrics

I have a problem, I can't keep it inside anymore
How far should I go?
What's the use if I stay?
I could never tell
They never understood

Why is everyone the enemy?
Why is everyone the enemy?
We forgot it all, Noah's breath
Don't come to me; you are different, i am different

I have a problem, I can't keep it inside anymore
How far should I go?
What's the use if I stay?
I could never tell
They never understood

Look, this is the final curtain
no game after that
No light, nothing
No no no

I have a problem
I have a problem
I have a problem
I have a problem
I have a problem
I have a problem, I can't keep it inside

You might also like5Embed",tr,"{'look', 'enemy', 'everyone', 'stay', 'use', 'inside', 'lyric', 'different', 'final', 'forgot', 'noah', 'keep', 'breath', 'problem', 'game', 'curtain', 'understood', 'light', 'far'}"
7,7,7,7,7,7,Dolu Kadehi Ters Tut,Gitme,"Gitme Lyrics

Gitme, kal
Gitme, kal
Ya da beni de yanına al da kalmayayım
Bir başıma bu diyarda
Sensiz olamam, yapamam
Beni de al yanına

Kokun artık yok buralarda
Duyabilmemin bi' yolu var da...
Korkuyorum çok, yitiriyorum aklımı
Derdim çok büyük, anla
Kalbim her teklediği anda heyecan basıyor umudunla
Gelemiyorum sana
Ne yapayım bana?
Bi' anlatın ama çaresi yok daha
Yanıyor, yanıyor, yanıyor içer'de
Kanıyor, kanıyor, kanıyor sensiz
Yanıyor, yanıyor, yanıyor içer'de
Kanıyor, kanıyor, kanıyor kalbim

Gitme, kal
Gitme, kal
Ya da beni de yanına al da kalmayayım
Bir başıma bu diyarda
Sensiz olamam, yapamam
Beni de al yanına

Senin kollarında başlayan sabahlara, biten gecelere doyamadım hâlâ
Huzur bulduğunda kıskanırmış işte hayat
Garip ama sen n'olur üzülme artık
Değilsin yalnız
Bu bir veda değil
Mutluyum, inan
Anladım, bi' şanstı bu
Aşkınla dolu bir gün bile bir ömür yeter bize

Gitme, kal
Gitme, kal
Ya da beni de yanına al da kalmayayım
Bir başıma bu diyarda
Sensiz olamam, yapamam
Beni de al yanınaYou might also like3Embed","Don't Go Lyrics

Do not go, stay
Do not go, stay
Or take me with you so I don't stay
Alone in this land
I can't be without you, I can't
Take me with you

Your smell is no more here
There's a way I can hear...
I'm so scared, I'm losing my mind
I'm in big trouble, understand
Every time my heart beats, excitement overflows with your hope
I can't come to you
What should I do to me?
Tell me but there is no solution yet
It's burning, it's burning, it's burning inside
Bleeding, bleeding, bleeding without you
It's burning, it's burning, it's burning inside
Bleeding, bleeding, bleeding heart

Do not go, stay
Do not go, stay
Or take me with you so I don't stay
Alone in this land
I can't be without you, I can't
Take me with you

I still can't get enough of the mornings that start in your arms and the nights that end
Life gets jealous when it finds peace
It's strange, but please don't be sad anymore
You are not alone
this is not goodbye
I'm happy, believe
Got it, it was luck
Even a day full of your love is enough for us

Do not go, stay
Do not go, stay
Or take me with you so I don't stay
Alone in this land
I can't be without you, I can't
You might also like3Embed",tr,"{'understand', 'life', 'strange', 'bleeding', 'beat', 'enough', 'hear', 'night', 'scared', 'peace', 'jealous', 'happy', 'stay', 'inside', 'alone', 'overflow', 'lyric', 'land', 'arm', 'hope', 'start', 'way', 'full', 'believe', 'morning', 'burning', 'sad', 'smell', 'love', 'solution', 'trouble', 'find', 'please', 'losing', 'excitement', 'time', 'heart', 'end', 'luck', 'mind', 'big', 'goodbye'}"
